<?xml version="1.0" encoding="UTF-8"?>
<beers xmlns:xsi="http://www.w3.org/2001/XMLSchema-instance"
       xsi:noNamespaceSchemaLocation="beers.xsd">
    <beer>
        <id>1</id>
        <name>Złoty Lager</name>
        <type>Lager</type>
        <brewery>Browar Regionalny</brewery>
        <alcohol>5.2</alcohol>
        <description>Klasyczne piwo typu lager o złotej barwie i delikatnym aromacie chmielu</description>
        <ingredients>
            <ingredient>Słód jęczmienny</ingredient>
            <ingredient>Chmiel</ingredient>
            <ingredient>Drożdże</ingredient>
            <ingredient>Woda</ingredient>
        </ingredients>
        <price>8.99</price>
    </beer>
    
    <beer>
        <id>2</id>
        <name>Ciemny Porter</name>
        <type>Porter</type>
        <brewery>Stary Browar</brewery>
        <alcohol>6.5</alcohol>
        <description>Mocne piwo o głębokim, karmelowym smaku z nutą palonego słodu</description>
        <ingredients>
            <ingredient>Słód pilzneński</ingredient>
            <ingredient>Słód palony</ingredient>
            <ingredient>Chmiel goryczkowy</ingredient>
            <ingredient>Drożdże górnej fermentacji</ingredient>
            <ingredient>Woda źródlana</ingredient>
        </ingredients>
        <price>11.99</price>
    </beer>
    
    <beer>
        <id>3</id>
        <name>Pszeniczne Klasyczne</name>
        <type>Wheat Beer</type>
        <brewery>Browar Rzemieślniczy</brewery>
        <alcohol>4.8</alcohol>
        <description>Orzeźwiające piwo pszeniczne z nutą banana i goździków</description>
        <ingredients>
            <ingredient>Słód pszeniczny</ingredient>
            <ingredient>Słód jęczmienny</ingredient>
            <ingredient>Chmiel aromatyczny</ingredient>
            <ingredient>Drożdże pszeniczne</ingredient>
            <ingredient>Woda mineralna</ingredient>
        </ingredients>
        <price>9.99</price>
    </beer>
</beers>